{"$schema":"https://json-schema.org/draft/2020-12/schema","$id":"https://agentpass.dev/contracts/maintenance-plan-v1.schema.json","type":"object","additionalProperties":false,"required":["schema_version","kind","plan_id","organization_id","app_id","repository_id","branch","advisory_id","selector_digests","files","authority"],"properties":{"schema_version":{"const":1},"kind":{"const":"agentpass.maintenance.plan"},"plan_id":{"type":"string"},"organization_id":{"type":"string"},"app_id":{"type":"string"},"repository_id":{"type":"string"},"branch":{"type":"string"},"advisory_id":{"type":"string"},"selector_digests":{"type":"array","minItems":1,"maxItems":64,"uniqueItems":true,"items":{"type":"string","pattern":"^[0-9a-f]{64}$"}},"files":{"type":"array","minItems":1,"maxItems":100,"items":{"type":"string","pattern":"^/[^\\0\\n\\r]*$"}},"authority":{"type":"object","additionalProperties":false,"required":["purpose","operations"],"properties":{"purpose":{"const":"agentpass.maintenance.plan"},"operations":{"type":"array","items":{"enum":["read_source","write_patch","run_tests"]}}}}}}
