{"schema_version":1,"kind":"agentpass.maintenance.plan","plan_id":"plan-1","organization_id":"org-1","app_id":"app-1","repository_id":"repo-1","branch":"main","advisory_id":"adv-endpoint-1","selector_digests":["aaaaaaaaaaaaaaaaaaaaaaaaaaaaaaaaaaaaaaaaaaaaaaaaaaaaaaaaaaaaaaaa"],"files":["/src/client.ts"],"authority":{"purpose":"agentpass.maintenance.plan","operations":["read_source","write_patch","run_tests"]}}
